<?xml version="1.0" encoding="UTF-8" ?>
<!--
# Licensed under the Apache License, Version 2.0 (the "License");
# you may not use this file except in compliance with the License.
# You may obtain a copy of the License at
#
#      http://www.apache.org/licenses/LICENSE-2.0
#
# Unless required by applicable law or agreed to in writing, software
# distributed under the License is distributed on an "AS IS" BASIS,
# WITHOUT WARRANTIES OR CONDITIONS OF ANY KIND, either express or implied.
# See the License for the specific language governing permissions and
# limitations under the License.
-->
<xs:schema xmlns:xs="http://www.w3.org/2001/XMLSchema">
  <xs:element name="playlist">
    <xs:complexType>
      <xs:sequence>
        <xs:element name="test" maxOccurs="unbounded" minOccurs="0">
          <xs:complexType>
            <xs:all>
              <xs:element name="featureIds" minOccurs="0">
                <xs:complexType>
                  <xs:sequence>
                    <xs:element type="xs:string" name="featureId" maxOccurs="unbounded"/>
                  </xs:sequence>
                </xs:complexType>
              </xs:element>
              <xs:element type="xs:string" name="testCaseName"/>
              <xs:element name="variations" minOccurs="0" >
                <xs:complexType>
                  <xs:sequence>
                    <xs:element type="xs:string" name="variation" maxOccurs="unbounded" minOccurs="0"/>
                  </xs:sequence>
                </xs:complexType>
              </xs:element>
              <xs:element type="xs:string" name="command"/>
              <xs:element type="xs:string" name="prologueTag" minOccurs="0"/>
              <xs:element type="xs:string" name="successCriteria" minOccurs="0"/>
              <xs:element type="xs:string" name="platforms" minOccurs="0"/>
              <xs:element type="xs:string" name="platformRequirements" minOccurs="0"/>
              <xs:element type="xs:string" name="id" minOccurs="0"/>
              <xs:element type="xs:string" name="dependencies" minOccurs="0"/>
              <xs:element type="xs:string" name="subsets" minOccurs="0"/>
              <xs:element name="tags" minOccurs="0">
                <xs:complexType>
                  <xs:sequence>
                    <xs:element type="xs:string" name="tag" maxOccurs="unbounded"/>
                  </xs:sequence>
                </xs:complexType>
              </xs:element>
              <xs:element name="subsets" minOccurs="0">
                <xs:complexType>
                  <xs:sequence>
                    <xs:element type="xs:string" name="subset" maxOccurs="unbounded"/>
                  </xs:sequence>
                </xs:complexType>
              </xs:element>
            </xs:all>
          </xs:complexType>
        </xs:element>
      </xs:sequence>
    </xs:complexType>
  </xs:element>
</xs:schema>