<?xml version="1.0" encoding="UTF-8"?>
<!--
# Licensed under the Apache License, Version 2.0 (the "License");
# you may not use this file except in compliance with the License.
# You may obtain a copy of the License at
#
#      http://www.apache.org/licenses/LICENSE-2.0
#
# Unless required by applicable law or agreed to in writing, software
# distributed under the License is distributed on an "AS IS" BASIS,
# WITHOUT WARRANTIES OR CONDITIONS OF ANY KIND, either express or implied.
# See the License for the specific language governing permissions and
# limitations under the License.
-->
<playlist xmlns:xsi="http://www.w3.org/2001/XMLSchema-instance" xsi:noNamespaceSchemaLocation="../TestConfig/playlist.xsd">
	<test>
		<testCaseName>OpenJDK_stackWalker</testCaseName>
		<command>$(JAVA_COMMAND) $(CMPRSSPTRS) -Xmx512m -jar $(Q)$(JTREG_DIR)$(D)lib$(D)jtreg.jar$(Q) \
	-agentvm -a -ea -esa -v:fail,error,time -retain:fail,error -ignore:quiet -timeoutFactor:4 -vmoptions:$(Q)-Xmx512m $(JVM_OPTIONS)$(Q) \
	-w $(Q)$(TEST_RESROOT)$(D)work$(Q) \
	-r $(Q)$(TEST_RESROOT)$(D)report$(Q) \
	-jdk:$(Q)$(JDK_HOME)$(Q) \
	-exclude:$(Q)$(JTREG_TEST_DIR)$(D)ProblemList.txt$(Q) \
	$(Q)$(JTREG_TEST_DIR)$(D)java$(D)lang$(D)StackWalker$(Q); \
	$(TEST_STATUS)</command>
		<subsets>
			<subset>SE90</subset>
		</subsets>
		<tags>
			<tag>openjdk</tag>
		</tags>
	</test>
	<test>
		<testCaseName>jdk_awt</testCaseName>
		<command>export DISPLAY=:1; $(JAVA_COMMAND) -Xmx512m -jar $(Q)$(JTREG_DIR)$(D)lib$(D)jtreg.jar$(Q) \
	$(JTREG_BASIC_OPTIONS)  -vmoptions:$(Q)-Xmx512m $(JVM_OPTIONS)$(Q) \
	-w $(Q)$(TEST_RESROOT)$(D)work$(Q) \
	-r $(Q)$(TEST_RESROOT)$(D)report$(Q) \
	-jdk:$(Q)$(JDK_HOME)$(Q) \
	-exclude:$(Q)$(JTREG_TEST_DIR)$(D)ProblemList.txt$(Q) \
	$(Q)$(JTREG_TEST_DIR):jdk_awt$(Q); \
	$(TEST_STATUS)</command>
		<subsets>
			<subset>SE80</subset>
		</subsets>
		<tags>
			<tag>extended</tag>
		</tags>
	</test>
	<test>
		<testCaseName>jdk_sound</testCaseName>
		<command>$(JAVA_COMMAND) -Xmx512m -jar $(Q)$(JTREG_DIR)$(D)lib$(D)jtreg.jar$(Q) \
	$(JTREG_BASIC_OPTIONS)  -vmoptions:$(Q)-Xmx512m $(JVM_OPTIONS)$(Q) \
	-w $(Q)$(TEST_RESROOT)$(D)work$(Q) \
	-r $(Q)$(TEST_RESROOT)$(D)report$(Q) \
	-jdk:$(Q)$(JDK_HOME)$(Q) \
	-exclude:$(Q)$(JTREG_TEST_DIR)$(D)ProblemList.txt$(Q) \
	$(Q)$(JTREG_TEST_DIR):jdk_sound$(Q); \
	$(TEST_STATUS)</command>
		<subsets>
			<subset>SE80</subset>
		</subsets>
		<tags>
			<tag>extended</tag>
		</tags>
	</test>
	<test>
		<testCaseName>jdk_swing</testCaseName>
		<command>export DISPLAY=:1; $(JAVA_COMMAND) -Xmx512m -jar $(Q)$(JTREG_DIR)$(D)lib$(D)jtreg.jar$(Q) \
	$(JTREG_BASIC_OPTIONS)  -vmoptions:$(Q)-Xmx512m $(JVM_OPTIONS)$(Q) \
	-w $(Q)$(TEST_RESROOT)$(D)work$(Q) \
	-r $(Q)$(TEST_RESROOT)$(D)report$(Q) \
	-jdk:$(Q)$(JDK_HOME)$(Q) \
	-exclude:$(Q)$(JTREG_TEST_DIR)$(D)ProblemList.txt$(Q) \
	$(Q)$(JTREG_TEST_DIR):jdk_swing$(Q); \
	$(TEST_STATUS)</command>
		<subsets>
			<subset>SE80</subset>
		</subsets>
		<tags>
			<tag>extended</tag>
		</tags>
	</test>
</playlist>