<?xml version="1.0" encoding="UTF-8"?>
<!--
# Licensed under the Apache License, Version 2.0 (the "License");
# you may not use this file except in compliance with the License.
# You may obtain a copy of the License at
#
#      http://www.apache.org/licenses/LICENSE-2.0
#
# Unless required by applicable law or agreed to in writing, software
# distributed under the License is distributed on an "AS IS" BASIS,
# WITHOUT WARRANTIES OR CONDITIONS OF ANY KIND, either express or implied.
# See the License for the specific language governing permissions and
# limitations under the License.
-->
<playlist xmlns:xsi="http://www.w3.org/2001/XMLSchema-instance" xsi:noNamespaceSchemaLocation="../TestConfig/playlist.xsd">
	<test>
		<testCaseName>SanityTestExample</testCaseName>
		<variations>
			<variation>-Xint</variation>
		</variations>
		<command>$(JAVA_COMMAND) $(JVM_OPTIONS) \
	-cp $(Q)$(RESOURCES_DIR)$(P)$(TESTNG)$(P)$(TEST_RESROOT)$(D)example.jar$(Q) \
	org.testng.TestNG -d $(REPORTDIR) $(Q)$(TEST_RESROOT)$(D)testng.xml$(Q) -testnames exampleTest \
	-groups $(TEST_GROUP) \
	-excludegroups $(DEFAULT_EXCLUDE); \
	$(TEST_STATUS)</command>
		<platformRequirements>os.linux,arch.x86,bits.64</platformRequirements>
		<tags>
			<tag>sanity</tag>
		</tags>
		<subsets>
			<subset>SE80</subset>
			<subset>SE90</subset>
		</subsets>
	</test>
		<test>
		<testCaseName>ExtendedTestExample</testCaseName>
		<variations>
			<variation>-Xint</variation>
		</variations>
		<command>$(JAVA_COMMAND) $(JVM_OPTIONS) \
	-cp $(Q)$(RESOURCES_DIR)$(P)$(TESTNG)$(P)$(TEST_RESROOT)$(D)example.jar$(Q) \
	org.testng.TestNG -d $(REPORTDIR) $(Q)$(TEST_RESROOT)$(D)testng.xml$(Q) -testnames exampleTest \
	-groups $(TEST_GROUP) \
	-excludegroups $(DEFAULT_EXCLUDE); \
	$(TEST_STATUS)</command>
		<platformRequirements>os.linux,arch.x86,bits.64</platformRequirements>
		<tags>
			<tag>extended</tag>
		</tags>
		<subsets>
			<subset>SE80</subset>
			<subset>SE90</subset>
		</subsets>
	</test>
</playlist>