<?xml version="1.0" encoding="UTF-8"?>
<!--
# Licensed under the Apache License, Version 2.0 (the "License");
# you may not use this file except in compliance with the License.
# You may obtain a copy of the License at
#
#      http://www.apache.org/licenses/LICENSE-2.0
#
# Unless required by applicable law or agreed to in writing, software
# distributed under the License is distributed on an "AS IS" BASIS,
# WITHOUT WARRANTIES OR CONDITIONS OF ANY KIND, either express or implied.
# See the License for the specific language governing permissions and
# limitations under the License.
-->
<playlist xmlns:xsi="http://www.w3.org/2001/XMLSchema-instance" xsi:noNamespaceSchemaLocation="../TestConfig/playlist.xsd">
	<test>
		<testCaseName>scala_test</testCaseName>
		<command>docker run -it --rm -v $(JDK_HOME):/java  adoptopenjdk-scala-test:latest "jvm pos neg"</command>
		<subsets>
			<subset>SE80</subset>
			<subset>SE90</subset>
		</subsets>
		<tags>
			<tag>external</tag>
		</tags>
	</test>
</playlist>